{
  "$schema": "https://json-schema.org/draft/2020-12/schema",
  "$id": "https://technicaleducationos.local/schemas/course.schema.json",
  "title": "TechnicalEducationOS canonical course",
  "type": "object",
  "additionalProperties": false,
  "required": [
    "schema_version",
    "course_id",
    "title",
    "description",
    "contact_hours",
    "standards",
    "competencies",
    "modules"
  ],
  "properties": {
    "schema_version": {"const": "2.0"},
    "course_id": {"$ref": "#/$defs/id"},
    "title": {"type": "string", "minLength": 1},
    "description": {"type": "string", "minLength": 1},
    "credit_hours": {"type": "number", "minimum": 0},
    "contact_hours": {"type": "number", "exclusiveMinimum": 0},
    "standards": {
      "type": "array",
      "items": {"type": "string", "minLength": 1}
    },
    "competencies": {
      "type": "array",
      "minItems": 1,
      "items": {
        "type": "object",
        "additionalProperties": false,
        "required": ["id", "statement", "standard_ids"],
        "properties": {
          "id": {"$ref": "#/$defs/id"},
          "statement": {"type": "string", "minLength": 1},
          "standard_ids": {
            "type": "array",
            "items": {"type": "string", "minLength": 1}
          }
        }
      }
    },
    "modules": {
      "type": "array",
      "minItems": 1,
      "items": {
        "type": "object",
        "additionalProperties": false,
        "required": ["id", "title", "unit_ids"],
        "properties": {
          "id": {"$ref": "#/$defs/id"},
          "title": {"type": "string", "minLength": 1},
          "unit_ids": {
            "type": "array",
            "minItems": 1,
            "items": {"$ref": "#/$defs/id"}
          }
        }
      }
    }
  },
  "$defs": {
    "id": {
      "type": "string",
      "pattern": "^[a-z0-9][a-z0-9._-]*$"
    }
  }
}
